<!DOCTYPE cross-model SYSTEM "crossmodel.dtd">
<cross-model>
   <cross-action id="default" a="ebenimeli">
        <description>Default pattern</description>
        <pattern>
            <e>
                <p>
                    <l>l1<s n="X1"/><s n="S1"/></l>
                    <r>l2<s n="X1"/><s n="S2"/></r>
                </p>
            </e>
            <e>
                <p>
                    <l>l3<s n="X1"/><s n="S3"/></l>
                    <r>l4<s n="X1"/><s n="S4"/></r>
                </p>
            </e>
        </pattern>
        <action-set>
            <action>
                <e>
                    <p>
                        <l>l1<s n="X1"/><s n="S1"/></l>
                        <r>l4<s n="X1"/><s n="S4"/></r>
                    </p>
                </e>
            </action>
        </action-set>
    </cross-action>
</cross-model>
