<!--
<!DOCTYPE cross-model SYSTEM "crossmodel.dtd">
-->
<cross-model>
    <cross-action id="default" a="ebenimeli">
        <description>Default pattern</description>
        <pattern>
            <e>
                <p>
                    <l>$lemmaA<s n="$cat"/><s n="@tailA"/></l>
                    <r>$lemmaB<s n="$cat"/><s n="*"/></r>
                </p>
            </e>
            <e>
                <p>
                    <l>$lemmaB<s n="$cat"/><s n="*"/></l>
                    <r>$lemmaC<s n="$cat"/><s n="@tailC"/></r>
                </p>
            </e>
        </pattern>
        <action-set>
            <action>
                <e>
                    <p>
                        <l>$lemmaA<s n="$cat"/><s n="@tailA"/></l>
                        <r>$lemmaC<s n="$cat"/><s n="@tailC"/></r>
                    </p>
                </e>
            </action>
        </action-set>
    </cross-action>
</cross-model>

